{
    "$schema": "../contractor_page_schema.json",
    "uuid": "873de6f3-e309-41eb-96fa-0780297fcf60",
    "description": "string",
    "title": "string",
    "contractor": {
        "uuid": "da4cfd8d-f522-4816-8615-f71be48971c9",
        "name": "Contracter name",
        "user_type": "contractor",
        "contact": {
            "email": "email@exmaple.com",
            "tel": null,
            "website": null
        },
        "updated": "2019-10-12T07:20:50.52Z",
        "created": "2019-10-12T07:20:50.52Z"
    },
    "images": [
        "/world/docs.webp"
    ],
    "updated": "2019-10-12T07:20:50.52Z",
    "created": "2019-10-12"
}